,Unnamed: 0,_id,address,ambience_rating,food_rating,rating,rest_name,review,review_length,review_title,rid,service_rating,url
0,0,5501b003ce17c917795f5b7b,"2100 Van Ness AvenueSan Francisco, CA  94109",4.0,5.0,4.4,Harris',"There's not much you can do wrong at Harris! The martinis are great, the wine list is actually a small book and most important : the food is just perfect!  If you want to eat the best steak in a very nice, traditional restaurant, Harris is your place!",251,"Great, traditional steak house",10,4.0,http://www.opentable.com/harris?rid=10&tab=2&page=1
1,1,5501b003ce17c917795f5b7c,"2100 Van Ness AvenueSan Francisco, CA  94109",4.0,5.0,4.4,Harris',This is the best steak house in the City.  The steaks are cooked perfectly and the service is very professional and friendly.  The ambiance is elegant and great for special occasions.,183,Meat lovers delight,10,5.0,http://www.opentable.com/harris?rid=10&tab=2&page=2
2,2,5501b003ce17c917795f5b7d,"2100 Van Ness AvenueSan Francisco, CA  94109",5.0,5.0,4.4,Harris',Great dinner!  We had a wonderful evening! Server was very attentive and accommodating.  Definitely going back!,111,Sweet Steak House!,10,4.0,http://www.opentable.com/harris?rid=10&tab=2&page=3
3,3,5501b004ce17c917795f5b7e,"2100 Van Ness AvenueSan Francisco, CA  94109",5.0,5.0,4.4,Harris',We eat at Harris' almost weekly and it's always good. The service especially keeps us coming back. It is the only place I dine where I don't feel at all nervous. I LOVE the ice tub the cocktails come in .,204,Always good,10,5.0,http://www.opentable.com/harris?rid=10&tab=2&page=4
4,4,5501b004ce17c917795f5b7f,"2100 Van Ness AvenueSan Francisco, CA  94109",5.0,5.0,4.4,Harris',I highly recommend this steakhouse. Great service and ambience was terrific! Had the Buffalo rib eye steak was the best I had. Recommend to anyone who want to enjoy a nice time out with your family or love one with the best steaks in SF.,237,Outstanding Steakhouse,10,5.0,http://www.opentable.com/harris?rid=10&tab=2&page=5
5,5,5501b004ce17c917795f5b80,"2100 Van Ness AvenueSan Francisco, CA  94109",5.0,5.0,4.4,Harris',"We (two couples) dined there twice within four days. Both times service was excellent, the food outstanding!
Very nice: the bar, adjacent to the dining room is a lively place for an after dinner drink. Or two....",212,We (two couples) dined there twice withi...,10,5.0,http://www.opentable.com/harris?rid=10&tab=2&page=6
6,6,5501b004ce17c917795f5b81,"2100 Van Ness AvenueSan Francisco, CA  94109",5.0,3.0,4.4,Harris',PEPPER STEAK NOT MEDIUM BUT WELL DONE BIG MISTAKE WITH SUCH A PRICE,67,PEPPER STEAK NOT MEDIUM BUT,10,5.0,http://www.opentable.com/harris?rid=10&tab=2&page=7
7,7,5501b005ce17c917795f5b83,"2100 Van Ness AvenueSan Francisco, CA  94109",5.0,5.0,4.4,Harris',"This was our first time at Harris. We had an excellent meal. I had the Niner which was cooked perfectly and tasted delicious. A perfect restaurant for listening to live, quiet piano music from the bar next door while you enjoy one of San Francisco's finest meals.",263,Great Experience,10,5.0,http://www.opentable.com/harris?rid=10&tab=2&page=9
8,8,5501b005ce17c917795f5b85,"2100 Van Ness AvenueSan Francisco, CA  94109",5.0,5.0,4.4,Harris',In service and the food is very well. Best Steaks of course,59,Constantly good,10,4.0,http://www.opentable.com/harris?rid=10&tab=2&page=11
9,9,5501b005ce17c917795f5b82,"2100 Van Ness AvenueSan Francisco, CA  94109",2.0,4.0,4.4,Harris',"The steaks and those lovely booths continue to be the star of the show. We had a lovely meal - but the service was not reflective of the quality of the space or the prices. Our waiter removed glasses and dishes from some of our party without asking if we were done. Perhaps staffing has been cut or there is something else going on but our waiter did not anticipate our needs, check back frequently (and unobtrusively) or show any sign that he had ever worked at a restaurant at this level. We were entertaining clients so did not say anything - but very disappointed that the evening was not up to the standards set at other visits to this restaurant. We will try again - the steaks are outstanding - so hoping this was an isolated incident.",742,The steaks and those lovely,10,4.0,http://www.opentable.com/harris?rid=10&tab=2&page=8
10,10,5501b005ce17c917795f5b84,"2100 Van Ness AvenueSan Francisco, CA  94109",5.0,5.0,4.4,Harris',"The 16-oz New York Strip was Very good!! A thick cut, but cooked very well throughout the whole piece. What I really liked about this place as well, is that they give you some very nice vegetables and your choice of potato as part of your entree. They don't ""nickel & dime"" you on a side-dish like a lot of steakhouses do. The wait-staff is very professional. A very nice and relaxing atmoshphere, and not loud at all. I will definitely repeat as a customer.",458,Very Nice Restaurant,10,5.0,http://www.opentable.com/harris?rid=10&tab=2&page=10
11,11,5501b006ce17c917795f5b86,"2100 Van Ness AvenueSan Francisco, CA  94109",3.0,4.0,4.4,Harris',"You might think you are in a Colorado mining town with the decor and warmth of San Francisco's Wayfare Tavern, just on the edge of the financial district. You're not, but you could be. Great atmosphere, vibrant bar scene, lots of choices (there is also a bar upstairs that many do not seem to know about.) Busy place ...make reservations. Food was very good, great drinks, good service. Just a very warm atmosphere; one of those neighborhood gems you will go back to time and again",481,Wonderful Food; Great Vibes,10,5.0,http://www.opentable.com/harris?rid=10&tab=2&page=12
12,12,5501b006ce17c917795f5b87,"2100 Van Ness AvenueSan Francisco, CA  94109",4.0,4.0,4.4,Harris',"The prime rib and meat is always fabulous at Harris'. The oysters [from BC] were outstanding. My only disappointment was the caesar salad that was so overdressed it was inedible - and the dressing was NOT caesar. I should have sent it back, but didn't. Our waiter was delightful and attentive. A special occasion spot - very pricey.",332,"Terrific prime rib, but............",10,4.0,http://www.opentable.com/harris?rid=10&tab=2&page=13
13,13,5501b006ce17c917795f5b88,"2100 Van Ness AvenueSan Francisco, CA  94109",3.0,5.0,4.4,Harris',"The Rib Eye and Prime Rib was delicious. The scallop potatoes was delicious as well, but the butter flavor was a bit overwhelming . . . too much butter. It would be great if Harris provided bacon for the baked potato. On the day I went there was a lack of waiters. Overall the experience and food at Harris was wonderful.",321,The Rib Eye and Prime Rib,10,4.0,http://www.opentable.com/harris?rid=10&tab=2&page=14
14,14,5501b006ce17c917795f5b89,"2100 Van Ness AvenueSan Francisco, CA  94109",5.0,5.0,4.4,Harris',"Harris' was a super choice we were seated right away in the lounge (per my online request)wonderful music on that side of the restaurant!... Service was prompt but not pushy, from drinks through dessert... Crab Cakes Deeelish/Oysters on the Half werent abundant in size the server made sure we got extra...to die for Peppercorn NY Steak 1st bite I was in Love... My husband had the big Rib Eye equally scrumptious... scalloped potatoes & snowpeas prepared perfectly...the lightest (not as heavy) Creme Brulee... If you love ambiance, great service and a perfect meal consider Harris!... (one small note our salad was overlooked it was fine... our meal was perfect without it)",675,Harris' was a super choice,10,5.0,http://www.opentable.com/harris?rid=10&tab=2&page=15
15,15,5501b007ce17c917795f5b8c,"2100 Van Ness AvenueSan Francisco, CA  94109",5.0,4.0,4.4,Harris',Excellent quality steak but slightly over cooked this last time. Cooked to medium instead of medium rare.,105,We love Harris',10,5.0,http://www.opentable.com/harris?rid=10&tab=2&page=16
16,16,5501b007ce17c917795f5b8d,"2100 Van Ness AvenueSan Francisco, CA  94109",5.0,5.0,4.4,Harris',"I dined alone and chose to eat at the bar to enjoy the live jazz. Pre-dinner cocktail - 10; Dinner - 10; Napa Smith Wheat beer with dinner - 10; Friendly, efficient staff - 10; Atmosphere in the bar area - 10; Overall - DUH!",224,Loved everything about Harris',10,5.0,http://www.opentable.com/harris?rid=10&tab=2&page=17
17,17,5501b007ce17c917795f5b8e,"2100 Van Ness AvenueSan Francisco, CA  94109",4.0,4.0,4.4,Harris',"When the food is good (which it is most of the time), it will blow your mind away. There was one occasion where the food was pretty mediocre and it was a disappointment because I brought a party of 6 with me. Usually though, when I go with just my girlfriend, the food is great!",278,Terrific Food,10,5.0,http://www.opentable.com/harris?rid=10&tab=2&page=18
18,18,5501b007ce17c917795f5b8f,"2100 Van Ness AvenueSan Francisco, CA  94109",5.0,5.0,4.4,Harris',"My husband and I celebrated our wedding anniversary at Harris on Monday and had a wonderful dining experience. The staff was very friendly and the food/beverages were perfection. My husband is a meat and potato's guy and he got the best NY Steak he's ever had at Harris. It's a very traditional menu -- no frou frou food and they execute it perfectly with the freshest ingredients and generous portions. We're definitely coming back again, soon!",445,Best Steakhouse in San Francisco!,10,4.0,http://www.opentable.com/harris?rid=10&tab=2&page=19
19,19,5501b008ce17c917795f5b90,"2100 Van Ness AvenueSan Francisco, CA  94109",5.0,5.0,4.4,Harris',This was a great surprise! It was delicious place for dinner. Service was excellant. Would definitely return and recommend. A must.,131,This was a great surprise!,10,5.0,http://www.opentable.com/harris?rid=10&tab=2&page=20
20,20,5501b008ce17c917795f5b91,"2100 Van Ness AvenueSan Francisco, CA  94109",2.0,3.0,4.4,Harris',"I do think Harris' is over-hyped. They mean well, I'm sure, but I've experienced better service elsewhere. Much better service, might I add.",140,I do think Harris' is over-hyped.,10,2.0,http://www.opentable.com/harris?rid=10&tab=2&page=21
21,21,5501b008ce17c917795f5b92,"2100 Van Ness AvenueSan Francisco, CA  94109",5.0,5.0,4.4,Harris',"Great place for a special date. They accommodate to you and if you don't like what you order, they will bring it back without charge. Fine dining at it's best.",159,Accomodates to YOU.,10,5.0,http://www.opentable.com/harris?rid=10&tab=2&page=22
22,22,5501b008ce17c917795f5b93,"2100 Van Ness AvenueSan Francisco, CA  94109",4.0,5.0,4.4,Harris',"Service was attentive until it came time to get the check which took a little longer than expected. Food was delivered promptly. Portions were good and food temperature was appropriate. My guests and I each had a steak medium-rare. They were cooked perfectly and the quality of the cuts was excellent. The wine list is extensive with a good range of mid-priced to high-priced options. Tables and booths are large and are well-spaced which makes dinner conversation easy. Overall, a top-shelf steakhouse.",503,Service was attentive until,10,4.0,http://www.opentable.com/harris?rid=10&tab=2&page=23
23,23,5501b008ce17c917795f5b94,"2100 Van Ness AvenueSan Francisco, CA  94109",2.0,2.0,4.4,Harris',"I don't usually write reviews, and I should probably do more. Unless something wows me, or disappoints me, it all falls in the realm of acceptable. Everything is relative of course, but based on what I was paying for this meal, I expected a lot more. I've had better steaks from non steak places. My rib eye and my date's filet were both ordered medium rare. The edge was pretty much well-done on the filet and medium at best on my rib eye. I inquired and was told that it's measured at the very center but by the time I got to the middle, I wasn't in much of a mood to cause any drama. Mine was medium, and my date's was medium to medium well, with barely any pink. Needless to say, I would have expected more from a steakhouse.",729,Poor execution,10,3.0,http://www.opentable.com/harris?rid=10&tab=2&page=24
24,24,5501b009ce17c917795f5b95,"2100 Van Ness AvenueSan Francisco, CA  94109",4.0,5.0,4.4,Harris',"The service was great and all the food was decadent and luscious. Our server overheard me mention it was my friend's birthday and brought over a special dessert with a candle without being asked. It was lovely, thank you.",221,The service was great and,10,4.0,http://www.opentable.com/harris?rid=10&tab=2&page=25
25,25,5501b009ce17c917795f5b96,"2100 Van Ness AvenueSan Francisco, CA  94109",1.0,4.0,4.4,Harris',What can I say. Food is good but service is better at Denny's. For an upscale steak house was quite surprised with the poor service. Our waiter stood talking to a guest at the bar and ignored our requests. Not once did the waiter make an effort to fill wine glasses. Next time I want want a good steak in San Francisco will try somewhere else,342,What can I say. Food is good,10,4.0,http://www.opentable.com/harris?rid=10&tab=2&page=26
26,26,5501b009ce17c917795f5b97,"2100 Van Ness AvenueSan Francisco, CA  94109",5.0,5.0,4.4,Harris',"The best beef in town as far as we're concerned!  Our last experience there was a standout--private dining room to celebrate our wedding.  The pre-arranged menu was enjoyed by all, the service outstanding.  A memorable evening with very memorable food!",252,The best beef in town as far,10,5.0,http://www.opentable.com/harris?rid=10&tab=2&page=27
27,27,5501b009ce17c917795f5b98,"2100 Van Ness AvenueSan Francisco, CA  94109",4.0,3.0,4.4,Harris',"We were looking for a nice steak dinner in San Francisco to celebrate a graduation, which this restaurant supplied. According to the Gayot website, this restaurant, was supposed to have entree prices around $35 and they were more like $45. There were no flowers in the middle of the large round table, making the decor a bit too austere. We were obviously put in the ""large party"" room (we had a party of 5) which was not very intimate and warm. (In their defense, the original reservation was for 6) The veal chop I had was not especially flavorful, but tender. I wish I had gotten the roast beef! The guest of honor enjoyed her steak 'though. Our server was thoughtful, very knowledgeable about everything we asked and attentive.",731,We were looking for a nice,10,2.0,http://www.opentable.com/harris?rid=10&tab=2&page=28
28,28,5501b00ace17c917795f5b99,"2100 Van Ness AvenueSan Francisco, CA  94109",5.0,5.0,4.4,Harris',"Meat! If you love a good steak, this may be the best place in town. And their prime rib could give the place up the street a run for it's money, too. The bar mixes your cocktail and gives you part of it on ice so you can linger over a martini without it getting warm. I do miss Mrs. Harris seating you, though, rest her soul.",325,MEAT!!!!,10,4.0,http://www.opentable.com/harris?rid=10&tab=2&page=29
29,29,5501b00ace17c917795f5b9a,"2100 Van Ness AvenueSan Francisco, CA  94109",2.0,4.0,4.4,Harris',"While the food was very good the service was extremely slow and staff was not attentive to our table. We do not mind leisurely dining but had to call the waiter over several time.
We have enjoyed much better service at lesser restaurants.",238,While the food was very good,10,4.0,http://www.opentable.com/harris?rid=10&tab=2&page=30
30,30,5501b00ace17c917795f5b9b,"2100 Van Ness AvenueSan Francisco, CA  94109",3.0,1.0,4.4,Harris',a premier steak house that overcooks a steak? Came here to celebrate my 30th birthday and was very disappointed. We had to wait 40 minutes from our last appetizers until we received our steaks which obviously were overcooked! WE didnt' bother sending back since we had waited so long and were famished.,302,a premier steak house that,10,2.0,http://www.opentable.com/harris?rid=10&tab=2&page=31
31,31,5501b00ace17c917795f5b9c,"2100 Van Ness AvenueSan Francisco, CA  94109",5.0,4.0,4.4,Harris',"The food was excellent steak house fare. The steaks were marvelous. The sides, salads, soup, desserts were great too. The staff was great, very accommodating. Joseph was our waiter and did a great job.",201,The food was excellent steak,10,4.0,http://www.opentable.com/harris?rid=10&tab=2&page=32
32,32,5501b00ace17c917795f5b9d,"2100 Van Ness AvenueSan Francisco, CA  94109",5.0,5.0,4.4,Harris',"We celebrated Mom's 95th birthday at Harris'. What a wonderful evening! Our server was excellent....she took a special interest in Mom and noticed that Mom particularly enjoys the cherries in her Old Fashion...her favorite cocktail. Our server came back with extra cherries for her to enjoy. We brought a special birthday cake which was elegantly plated. Our server appeared with that little something extra....a scoop of cherry ice cream for mom. She felt so celebrated! A special memory for all of us! Oh...the food was delicious. Three of us ordered Filet Mignon Rossini with grilled fois de gras and black truffle, cabernet sauce. It was the best filet I have ever had! Mom, had her favorite....Roast Prime Rib with all the trimings!",737,We celebrated Mom's 95th birthday,10,4.0,http://www.opentable.com/harris?rid=10&tab=2&page=33
33,33,5501b00bce17c917795f5b9e,"2100 Van Ness AvenueSan Francisco, CA  94109",3.0,2.0,4.4,Harris',"We were very disappointed in the food at Harris,
We have visited numerous Steak Houses and we were looking forward to visiting this highly recommended restaurant and we were not happy when we left",196,We were very disappointed,10,3.0,http://www.opentable.com/harris?rid=10&tab=2&page=34
34,34,5501b00bce17c917795f5b9f,"2100 Van Ness AvenueSan Francisco, CA  94109",5.0,5.0,4.4,Harris',Great food and the best steak and lobster in the city.,54,Great food and the best steak,10,5.0,http://www.opentable.com/harris?rid=10&tab=2&page=35
35,35,5501b00bce17c917795f5ba0,"2100 Van Ness AvenueSan Francisco, CA  94109",4.0,4.0,4.4,Harris',Harris is a wonderful San Francisco institution that serves up a great steak in a lovely traditional atmosphere. It is expensive so I would reserve it for a special occasion. The desert menu does not quite match the breath of the entree menu so I would opt for having the desert at another location next time.,309,Harris is a wonderful San,10,5.0,http://www.opentable.com/harris?rid=10&tab=2&page=36
36,36,5501b00bce17c917795f5ba1,"2100 Van Ness AvenueSan Francisco, CA  94109",2.0,3.0,4.4,Harris',Can get very loud. Very expensive. Service could be more attentive.,67,Can get very loud. Very expensive.,10,3.0,http://www.opentable.com/harris?rid=10&tab=2&page=49
37,37,5501b00cce17c917795f5ba2,"2100 Van Ness AvenueSan Francisco, CA  94109",5.0,5.0,4.4,Harris',"Was great.Delicious steacks,very frendly and kind staff, very effective.I definitily recommend it.",98,"Was great.Delicious steacks,very",10,4.0,http://www.opentable.com/harris?rid=10&tab=2&page=37
38,38,5501b00cce17c917795f5ba3,"2100 Van Ness AvenueSan Francisco, CA  94109",5.0,5.0,4.4,Harris',"Wonderful top notch dining experience. Attentive professional wait staff, high quality food, complete wine list, elegant atmosphere, and valet parking all make Harris' the place to insure a perfect celebration or just a great meal out! Thanks!",243,Wonderful top notch dining,10,5.0,http://www.opentable.com/harris?rid=10&tab=2&page=38
39,39,5501b00cce17c917795f5ba4,"2100 Van Ness AvenueSan Francisco, CA  94109",5.0,5.0,4.4,Harris',Excellent. We had a special birthday party and the staff could not have been more helpful. Our server was on top of everything including giving us a bit of the history of the restaurant. They seated us in the small room with a fireplace which was just perfect. Excellent appetizers (love the smoked salmon and steak tartare). Filets and prime rib were fabulous.,361,Excellent. We had a special,10,5.0,http://www.opentable.com/harris?rid=10&tab=2&page=39
40,40,5501b00cce17c917795f5ba5,"2100 Van Ness AvenueSan Francisco, CA  94109",2.0,3.0,4.4,Harris',Less and less enthused with Harris'. Live on east coast and have been to Harris' approximately 5 times in last 3 years. Last 2 times were not up to the prior standards. Service was NOT spot on. Rolls were over cooked and had a burned taste. Creme Brulee had been under the flame to long and the carmelized top tasted burnt. I will not be going on my next trip to SFO.,367,Less and less enthused with,10,4.0,http://www.opentable.com/harris?rid=10&tab=2&page=40
41,41,5501b00cce17c917795f5ba6,"2100 Van Ness AvenueSan Francisco, CA  94109",3.0,4.0,4.4,Harris',"We did not have a good table, right by the door. We have dined here many times and this was the first time we were disappointed by the table and service and food quality was not as good as usual.",195,"We did not have a good table,",10,3.0,http://www.opentable.com/harris?rid=10&tab=2&page=41
42,42,5501b00dce17c917795f5ba7,"2100 Van Ness AvenueSan Francisco, CA  94109",3.0,3.0,4.4,Harris',"I was disappointed by my recent experience at Harris'. I was in San Francisco on business and visited Harris' on a recommendation from a associate. Unfortunately, I would not recommend this place to others. The restaurant was very old and stuffy. There was zero energy in the place, granted it was 7pm on a Wednesday evening. Onion soup was nothing special. The filet mignon I ordered was a decent size, but did not have my flavor. My co-worker ordered her filet medium rare and had to send her meal back twice because it was way over-cooked. Overall, quite a disappointing experience. The waitress was very apologetic and tried her best, but couldn't make up for the lack in food quality. For the prices charged, I was expecting better!",737,I was disappointed by my recent,10,2.0,http://www.opentable.com/harris?rid=10&tab=2&page=42
43,43,5501b00dce17c917795f5ba8,"2100 Van Ness AvenueSan Francisco, CA  94109",4.0,5.0,4.4,Harris',Harris' is consistently our favorite steakhouse in SF. I don't think the service is quite as attentive as it used to be (no one wisked the crumbs off our table before dessert) but this is a very minor critique. The steaks can't be beat. I'd much rather eat here than Morton's or Ruth Chris.,290,Harris' is consistently our,10,5.0,http://www.opentable.com/harris?rid=10&tab=2&page=43
44,44,5501b00dce17c917795f5ba9,"2100 Van Ness AvenueSan Francisco, CA  94109",4.0,3.0,4.4,Harris',"Probably the best steak house in San Francisco. Bravo for the Steak Diane. We loved the creamed spinach, too. For clubby atmosphere and a really retro feeling in the bar with an old school pianist, it is an escape from all that is too fast, too noisy, too predictable and too young! This is a hip hideaway for those of us who remember when.

I was disappointed in the cocktails! I ordererd an Old Fashioned and it came in a huge glass with too much ice and water - go back, please, to the original version. And my dining companion's Appletini came with a maraschino cherry instead of a nice slice of green apple. . .

But I will go again. And again, when I want a really good steak.",682,Probably the best steak house,10,4.0,http://www.opentable.com/harris?rid=10&tab=2&page=44
45,45,5501b00dce17c917795f5baa,"2100 Van Ness AvenueSan Francisco, CA  94109",5.0,5.0,4.4,Harris',"Fantastic steaks in a classic and classy steakhouse atmosphere. I wouldn't change a thing, though one wonders how many people are prepared to pay $170 for a piece of Japanese beef.",180,Fantastic steaks in a classic,10,5.0,http://www.opentable.com/harris?rid=10&tab=2&page=45
46,46,5501b00ece17c917795f5bab,"2100 Van Ness AvenueSan Francisco, CA  94109",5.0,5.0,4.4,Harris',"SO fantastic, Harris' exceeded my expectations. We went there for my boyfriend's birthday, and they treated us as though we were as important as the businessmen sitting at the next table. The food was excellent, and that coupled with the atmosphere and great service made this an evening to remember.",300,"SO fantastic, Harris' exceeded",10,5.0,http://www.opentable.com/harris?rid=10&tab=2&page=46
47,47,5501b00ece17c917795f5bac,"2100 Van Ness AvenueSan Francisco, CA  94109",4.0,4.0,4.4,Harris',"The food did meet my expectations. I've eaten at other restaurants, bought filet Mignon at local store and butchers to cook at home only to find the quality disappointing even after paying a hefty price for them. Harris by far had the best cut, no fat or chewy vains to distract form the experience. Simply put the best filet I've had.",335,The food did meet my expectations.,10,4.0,http://www.opentable.com/harris?rid=10&tab=2&page=47
48,48,5501b00ece17c917795f5bad,"2100 Van Ness AvenueSan Francisco, CA  94109",4.0,5.0,4.4,Harris',"Everything was really lovely! We had a fabulous time taking out our parents for Mother's Day, and they absolutely loved the experience! The steak was to-die-for, and all the accompaniments and apps were super yummy. The meal was quality all around, and the noise level was much more quiet and sane than I expected. It was a treat for our out-of-town guests! Thanks so much!",373,Everything was really lovely!,10,4.0,http://www.opentable.com/harris?rid=10&tab=2&page=48
49,49,5501b019ce17c917795f5be3,"1001 Minnesota StreetSan Francisco, CA  94107",5.0,5.0,4.3,Piccino,"This was one of the best dining experiences I've had in San Francisco. Our server, Maya was knowledgeable and friendly. She picked out great wines for us that paired perfectly with the food. Everything we ate was divine and the crowd was lively but not loud. The ambiance is lovely. I'll go back again! Thanks for a great night!",328,This was one of the best dining experien...,100033,5.0,http://www.opentable.com/piccino?rid=100033&tab=2&page=1
