,Unnamed: 0,_id,address,ambience_rating,food_rating,rating,rest_name,review,review_length,review_title,rid,service_rating,url
388,388,5501baebce17c917795f8c55,"345 Spear St.San Francisco, CA  94105",5.0,4.0,3.9,Palomino - San Francisco,Palomino is one of our favorite restaurants in S.F. (we live on the Peninsula but come to the city frequently). Parking is convenient (a miracle in S.F.) as is access to the 280 freeway. Hostesses and servers are pleasant and helpful. Our Open Table reservations are always honored even when the restaurant and bar are very crowded. Menu choices are varied and nicely presented; the food excellent.,398,Palomino is one of our favorite,1101,4.0,http://www.opentable.com/palomino-san-francisco?rid=1101&tab=2&page=15
389,389,5501baebce17c917795f8c56,"345 Spear St.San Francisco, CA  94105",4.0,3.0,3.9,Palomino - San Francisco,Our server was very friendly. The staff was on point. Will be back to enjoy the patio on a warm night.,102,Our server was very friendly.,1101,5.0,http://www.opentable.com/palomino-san-francisco?rid=1101&tab=2&page=16
390,390,5501baecce17c917795f8c57,"345 Spear St.San Francisco, CA  94105",2.0,1.0,3.9,Palomino - San Francisco,"After writing several positive reviews of Palomino and recommending it to friends, I was very disappointed in my last visit. I asked the server would she recommend the lobster gnocchi. She said yes, ""lots of lobster swimming in a rich lobster butter sauce with lots of gnocchi"". When it came, my friend and I both asked-where's the rest of the dish? There were 12 very overcooked mushy gnocchi, two small pieces of lobster, a flavorless sauce with a few peas and what looked like mushroom pieces. The entire dish would have filled one cup. For $19, this was ridiculous. My friend had a sandwich which was not much better. The server never came back to ask how things were and I said nothing. Very expensive, poorly cooked, small dishes.",736,Years of good experiences no more,1101,3.0,http://www.opentable.com/palomino-san-francisco?rid=1101&tab=2&page=17
391,391,5501baecce17c917795f8c58,"345 Spear St.San Francisco, CA  94105",1.0,3.0,3.9,Palomino - San Francisco,"I hope I wasn't expecting too much. We reserved a table but had to wait, as no table was ready. When we finally got seated, it took a while for the server to come over and get our order for drinks, and an even longer time to get our orders taken. One of us ordered salmon, and it was unbelievably rare. All the other dishes were good though. They comp'd that and gave us free dessert...but still!

I can't decide if I want to come back or not. The food was great, so maybe it's worth a second shot.",498,I hope I wasn't expecting,1101,3.0,http://www.opentable.com/palomino-san-francisco?rid=1101&tab=2&page=18
392,392,5501baecce17c917795f8c59,"345 Spear St.San Francisco, CA  94105",5.0,5.0,3.9,Palomino - San Francisco,Lovely atmosphere & wonderful food. I could sit there for hours.,64,Lovely atmosphere & wonderful,1101,5.0,http://www.opentable.com/palomino-san-francisco?rid=1101&tab=2&page=19
393,393,5501baecce17c917795f8c5a,"345 Spear St.San Francisco, CA  94105",4.0,4.0,3.9,Palomino - San Francisco,"Great experience! Made last minute reservations for lunch & we enjoyed the beautiful afternoon on the patio. Raquel was our server. She was fun, very knowledgeable and made some great recommendations. I had the charred greens salad from the temporary Tuscan menu (don't miss it). Also treated my friend to classiscs like the crab & artichoke dip and the gorgonzola potatoes. It's worth the walk to have great food like this in a wonderful outdoor atmosphere! Palomino's is the perfect spot for downtown Happy Hour, too!",519,A perfect view,1101,5.0,http://www.opentable.com/palomino-san-francisco?rid=1101&tab=2&page=20
394,394,5501baedce17c917795f8c5b,"345 Spear St.San Francisco, CA  94105",4.0,4.0,3.9,Palomino - San Francisco,Great lunch menu. Went with a large group. Prices were reasonable and everyone LOVED the food. Portobello Mushroom soup was exceptional. Also had a sweat pea soup that others raved about. Great with a 1/2 sandwich.,214,Great lunch menu. Went with,1101,4.0,http://www.opentable.com/palomino-san-francisco?rid=1101&tab=2&page=21
395,395,5501baedce17c917795f8c5c,"345 Spear St.San Francisco, CA  94105",4.0,3.0,3.9,Palomino - San Francisco,"food is okay - they could use some thinner entrees, but it is a good meal. Bar scene is wonderful - inside and out, lot so people and activity, fun to watch and apparently easy to participate.",192,food is okay - they could,1101,4.0,http://www.opentable.com/palomino-san-francisco?rid=1101&tab=2&page=22
396,396,5501baedce17c917795f8c5d,"345 Spear St.San Francisco, CA  94105",3.0,3.0,3.9,Palomino - San Francisco,This is a reliable choice with the added benefit of underground parking.,72,This is a reliable choice,1101,4.0,http://www.opentable.com/palomino-san-francisco?rid=1101&tab=2&page=23
397,397,5501baedce17c917795f8c5e,"345 Spear St.San Francisco, CA  94105",1.0,2.0,3.9,Palomino - San Francisco,"Food was not good (it used to be great), service was BAD, the waiter was rushing us, no eye contact and unfriendly!",115,Food was not good (it used,1101,3.0,http://www.opentable.com/palomino-san-francisco?rid=1101&tab=2&page=24
398,398,5501baeece17c917795f8c5f,"345 Spear St.San Francisco, CA  94105",1.0,3.0,3.9,Palomino - San Francisco,"The service was horrible. After we sat down and browsed our menus, we sat there for another 15 mins just looking for our waiter with not even water served to us. Eventually a waiter for another table noticed our frustration and took our order. Not only was the restaurant loud, it was clearly understaffed which which made for a disappointing evening. We will not be dining here again and I would recommend anyone make dinner plans elsewhere unless you need to kill time and be a people watcher. On the other hand, the cocktails were delicious.",544,The service was horrible.,1101,1.0,http://www.opentable.com/palomino-san-francisco?rid=1101&tab=2&page=25
399,399,5501baeece17c917795f8c60,"345 Spear St.San Francisco, CA  94105",2.0,3.0,3.9,Palomino - San Francisco,We had to wait at least 15 minutes for our table despite the reservation and the hostess wasn't clear in telling us what was going on.,134,We had to wait at least 15,1101,3.0,http://www.opentable.com/palomino-san-francisco?rid=1101&tab=2&page=26
400,400,5501baeece17c917795f8c61,"345 Spear St.San Francisco, CA  94105",1.0,2.0,3.9,Palomino - San Francisco,"I have dined at Palomino over 10x, but this experience was the WORST ever! We requested outdoor seating, but upon check-in the weather was chilly, so we requested dining room seating. The host then proceeded to seat us outdoors. I asked for the heat lamps to be turned on 4x, was reassurred that it would be done, then told the 3rd time I asked that the heater had to be turned on by the manager. I asked for lemon for water 3x, ordered my burger med rare with no mayo - it came well done with a dijonnaise slathered on both sides of the bun. We had to ask for diet coke multiple times. Chopped salad which was ordered w/o basil, dressing on side came fully dressed with basil which they told me was on the top, but was mixed in throughout.",740,I have dined at Palomino over,1101,3.0,http://www.opentable.com/palomino-san-francisco?rid=1101&tab=2&page=27
401,401,5501baefce17c917795f8c62,"345 Spear St.San Francisco, CA  94105",4.0,3.0,3.9,Palomino - San Francisco,"Enjoyed a nice dinner on new years eve. Excellent service in the bar. Excellent service by the waiter and his support staff. Average food (but we knew this going there), no fixed price menu was a big plus!",205,Enjoyed a nice dinner on new,1101,3.0,http://www.opentable.com/palomino-san-francisco?rid=1101&tab=2&page=28
402,402,5501baefce17c917795f8c63,"345 Spear St.San Francisco, CA  94105",5.0,3.0,3.9,Palomino - San Francisco,"Excellent service, beautiful decor, everyone very attentive, nice view, requested quiet romantic table and got one. If you like lots of action there are tables for that too. Great dip for the bread. Beware that the linguine comes with hot pepper flakes which is not stated on the menu. Had to send it back both times. Great house Margaritas.",341,"Excellent service, beautiful",1101,5.0,http://www.opentable.com/palomino-san-francisco?rid=1101&tab=2&page=29
403,403,5501baefce17c917795f8c64,"345 Spear St.San Francisco, CA  94105",3.0,3.0,3.9,Palomino - San Francisco,This was the second time I hosted a brunch there and everyone was happy. I will definitely come back. It was 10 ladies who were very hungry. My only comment would be to add more brunch items and more seasonal fruit. Ladies love the fresh fruit!,244,This was the second time I,1101,4.0,http://www.opentable.com/palomino-san-francisco?rid=1101&tab=2&page=30
404,404,5501baefce17c917795f8c65,"345 Spear St.San Francisco, CA  94105",4.0,4.0,3.9,Palomino - San Francisco,"We've eaten here at least a dozen times. Palomino is always dependable and delicious. And the service is great. We came once on a Friday around 6, and the place can be really noisy then with the after-work cocktail crowd.",221,We've eaten here at least,1101,4.0,http://www.opentable.com/palomino-san-francisco?rid=1101&tab=2&page=31
405,405,5501baf0ce17c917795f8c66,"345 Spear St.San Francisco, CA  94105",4.0,4.0,3.9,Palomino - San Francisco,"My family and I have been coming to Palomino's ever since 1995 and have enjoyed countless lunches and dinners throughout the years. The food is always good, the ambience casual but dramatic, and the waitstaff is friendly and unpretentious. There's also a nice view of the bay bridge. The prices aren't bad either.",313,My family and I have been,1101,4.0,http://www.opentable.com/palomino-san-francisco?rid=1101&tab=2&page=32
406,406,5501baf0ce17c917795f8c67,"345 Spear St.San Francisco, CA  94105",4.0,2.0,3.9,Palomino - San Francisco,The food and service is very uneven from one visit to the next.,63,The food and service is very,1101,2.0,http://www.opentable.com/palomino-san-francisco?rid=1101&tab=2&page=33
407,407,5501baf0ce17c917795f8c68,"345 Spear St.San Francisco, CA  94105",4.0,4.0,3.9,Palomino - San Francisco,"It was our first visit to Palomino. We enjoyed the menu, the service, and the atmosphere. The wine list was not quite what we had hoped for, but we would definitely go again.",174,It was our first visit to,1101,4.0,http://www.opentable.com/palomino-san-francisco?rid=1101&tab=2&page=34
408,408,5501baf1ce17c917795f8c69,"345 Spear St.San Francisco, CA  94105",4.0,4.0,3.9,Palomino - San Francisco,"Given that this restaurant frequently mails ""2 for 1"" coupons, I figured it wouldn't be all that great. We were pleasantly surprised. Our table was waiting at the appointed hour, the hostess and waiter were very knowledgeable and friendly with some good suggestions. The menu had several interesting dishes (I had seared scallops with an interesting polenta and a side of grilled asparagus.) Food was much better and interestingly presented than we expected. At the end of the meal they gave us....you guessed it....another ""2 for the price of 1"" coupon.

Only downside was that like many SF restaurants, when it gets crowded it gets so noisey that it is impossible to carry on a conversation. Go early.",703,Given that this restaurant,1101,3.0,http://www.opentable.com/palomino-san-francisco?rid=1101&tab=2&page=35
409,409,5501baf1ce17c917795f8c6a,"345 Spear St.San Francisco, CA  94105",3.0,3.0,3.9,Palomino - San Francisco,"very disapointed , as san francisco is a great place for fancy restaurant palomino is not in place at san francisco , as i sow the publicite of palomino on there web site . when i arrived at the restaurant ,i have been badly surprise , i expected a great and fancy restaurant ,with great and fancy food , and i can tell you the plates are doll ,no taste , the ambiance look like a cafeteria in a hospital , the only thing who save my diner ... yhe wauter was nicely gentel and he did his best , but i regret . i losted my times and i will never return
the night before i webt to boulevard restaurant . whaaaaat a difference . boulevard is one among the greatest restaurant in san francisco .
ps i,m an executive chef in canada i know food",738,"very disapointed , as san",1101,2.0,http://www.opentable.com/palomino-san-francisco?rid=1101&tab=2&page=36
410,410,5501baf1ce17c917795f8c6b,"345 Spear St.San Francisco, CA  94105",4.0,5.0,3.9,Palomino - San Francisco,"While my wife and I have enjoyed going to Palomino every second Saturday for the last couple of months, I will never go to that place again. We had a reservation for 7.00 last Saturday. Because my wife's plane arrived a bit early, we reached the restaurant at 6.30, only to be informed by a surly hostess: ""Because your reservations are at 7 o'clock, you WILL have to wait half an hour."" The restaurant was about half full at that time. --  So we elected to go to the welcoming Epic restaurant across the street, where they accomodated us by setting a new table in spite of the fact that the reastaurant was virtually full. The meal at Epic was superb, as was the entire dining experience with a welcoming staff. Good bye Palomino!",731,While my wife and I have enjoyed,1101,4.0,http://www.opentable.com/palomino-san-francisco?rid=1101&tab=2&page=37
411,411,5501baf1ce17c917795f8c6c,"345 Spear St.San Francisco, CA  94105",4.0,5.0,3.9,Palomino - San Francisco,Great food and great view of Bay Bridge.  Parking and freeway access are great.,79,Great food and great view,1101,5.0,http://www.opentable.com/palomino-san-francisco?rid=1101&tab=2&page=38
412,412,5501baf2ce17c917795f8c6d,"345 Spear St.San Francisco, CA  94105",2.0,3.0,3.9,Palomino - San Francisco,"Dear Sir/Madam,

On 5/18/08, I had afternoon cocktails at Palimons and my bank account was charged $2 more than the amount I signed for!  A charge for $33.67 was posted to my account on 5/20/08 when it should have been $31.67.  Please refund my account for the difference of $2.  You may contact me on my mobile phone 510-717-0659.

Regards,",345,"Dear Sir/Madam,

On 5/18/08,",1101,3.0,http://www.opentable.com/palomino-san-francisco?rid=1101&tab=2&page=39
413,413,5501baf2ce17c917795f8c6e,"345 Spear St.San Francisco, CA  94105",1.0,4.0,3.9,Palomino - San Francisco,"After having great dining experience with 3 other area restaurants last week, we were disappointed with Palomino. We had a 7 PM rsvp; not seated until 7:20. Had come early, waited in bar; took 10 minutes for waitress to order drinks; another 10 to get them. 

After finally being seated, the service improved. The food was excellent and the birthday occasion was recognized by a 'surprise' birthday cake with candle.",418,After having great dining,1101,3.0,http://www.opentable.com/palomino-san-francisco?rid=1101&tab=2&page=40
414,414,5501baf2ce17c917795f8c6f,"345 Spear St.San Francisco, CA  94105",4.0,3.0,3.9,Palomino - San Francisco,Palomino is a good restaurant with attentive service and a good view of the Bay and the bridge.,95,Palomino is a good restaurant,1101,4.0,http://www.opentable.com/palomino-san-francisco?rid=1101&tab=2&page=41
415,415,5501bb8bce17c917795f8eeb,"373 BroadwaySan Francisco, CA  94133",4.0,2.0,4.5,Coi,not recommended. too expensive and the food is not that good.,61,extremetely expensive for the food that served.,11065,3.0,http://www.opentable.com/coi?rid=11065&tab=2&page=1
416,416,5501bb8bce17c917795f8eec,"373 BroadwaySan Francisco, CA  94133",5.0,5.0,4.5,Coi,"This is a prix fix menu with an exorbitant price.  Unlike some restaurants that ""perform,"" this place is all about the food.  It comes in small bites and regularly.  It's not overwhelming -  but you never feel like you're waiting for the next course.  In addition to the courses we expected several other tidbits, palate cleansers, and treats were served.  We were seated at our table on a U-shaped sofa (it accommodated 2 tables seating 2 couples.)  Even with pillows, you aren't comfortably close to the table.  Serving plates were of a rustic sort and didn't go with the rest of the restaurant decor.  Waiters all wear the same ill-fitting charcoal jackets, as if selected from a closet - the first to get there, get the ones that fit.",738,Prepare to be Amazed,11065,3.0,http://www.opentable.com/coi?rid=11065&tab=2&page=2
417,417,5501bb8bce17c917795f8eed,"373 BroadwaySan Francisco, CA  94133",5.0,5.0,4.5,Coi,"Okay so first off the price is a bit on the out-there scale for me.  Roughly $700 for two!  However, it really was worth it, I mean every dish was outstanding!  It is a place that will remain in my memories for a long time.  Not many great restaurants in ""The City"" can do that for me.  Places like Gary Danko did not come close to this place in the food experience.  Honestly,  the worst part of the dinner for me was the coffee which I ordered with dessert, defiantly not worth the $8.  Yet, every other part of the service and food presented was top notch and handled with care.      If I had the income I would be back again.  However, it will be a place reserved for resetting the high bar of food experience that all others continue to miss.",747,Foodie Heaven,11065,5.0,http://www.opentable.com/coi?rid=11065&tab=2&page=3
418,418,5501bb8cce17c917795f8eee,"373 BroadwaySan Francisco, CA  94133",5.0,5.0,4.5,Coi,"Coi invites you to pay attention to the wonders of what can happen inside your mouth. A series of small plates play with contrasts, texture, and color---sweet and salty, pungent and airy, citrus and smooth---so one slows down---to enter a mindful eating zone, to explore nuance and try to figure out origins.

The service is attentive but not pretentious. Coi will close in January to freshen its decor. A good idea. The food, the intimacy, the informality make Coi a unique pleasure.",484,Taste inspires mindful meditation,11065,4.0,http://www.opentable.com/coi?rid=11065&tab=2&page=4
419,419,5501bb8cce17c917795f8eef,"373 BroadwaySan Francisco, CA  94133",5.0,5.0,4.5,Coi,"We loved our experience at Coi. From the moment we walked in, we felt warmly welcomed, and the exceptional service continued throughout the evening. Each dish was prepared to perfection. Highly recommended!",206,Exceptional,11065,4.0,http://www.opentable.com/coi?rid=11065&tab=2&page=5
420,420,5501bb8cce17c917795f8ef0,"373 BroadwaySan Francisco, CA  94133",5.0,4.0,4.5,Coi,"From a service perspective, Coi really earns its Michelin stars...and most dishes are really great...i can't give it 5 stars though, because it missed the mark on the main course, the Lamb. Most of the other dishes were really excellent, but I found myself fighting with the lamb...trying to cut it, trying to separate it from the mass of fat it had on it.

The wine pairing were quite good; almost all of them were perfect. I'd recommend it, and really did enjoy it, but it wasn't amazing.",490,"A Good Experience, Almost Great...",11065,4.0,http://www.opentable.com/coi?rid=11065&tab=2&page=6
421,421,5501bb8cce17c917795f8ef1,"373 BroadwaySan Francisco, CA  94133",5.0,5.0,4.5,Coi,incredible evening and perfect for the special occasion we were celebrating,75,incredible evening and perfect,11065,4.0,http://www.opentable.com/coi?rid=11065&tab=2&page=7
422,422,5501bb8dce17c917795f8ef2,"373 BroadwaySan Francisco, CA  94133",5.0,5.0,4.5,Coi,"Lots of trendy places offer fixed price 7+ course meals. Coi is unique. The menu fit together in a way even Paris three-star places like Le Meurice do not achieve. Not every dish is a ""wow"" dish, but they have character. Only room for provement is the wine pairing. The two Hungarian wines don't make the grade.",311,Lots of trendy places offer,11065,5.0,http://www.opentable.com/coi?rid=11065&tab=2&page=8
423,423,5501bb8dce17c917795f8ef3,"373 BroadwaySan Francisco, CA  94133",5.0,3.0,4.5,Coi,"I really, really wanted to love Coi.  I have heard such amazing things about it.  But it just didn't really live up to the praise.  The food was fairly uninventive, but well-executed.  Service was exceptional.  I came with my son, and we were treated very nicely.  Ultimately, the food must be exciting, and i just didnt see it.  I feel sacrilegious saying it, but I need to be honest about my view.  I would return eventually because it had promise, but at the price point they were charging, it warrants a special (truly special) occasion.  I prefer other restaurants that are taking massive risks to present great food like atelier crenn and commonwealth.  Coi has a good reputation, but needs to put out food that is better.",728,"service exceptional, food fails",11065,4.0,http://www.opentable.com/coi?rid=11065&tab=2&page=9
424,424,5501bb8dce17c917795f8ef4,"373 BroadwaySan Francisco, CA  94133",4.0,3.0,4.5,Coi,"Food was good, but not as good as Benu or La Folie. All dishes were good, with some interesting ideas/combinations, but just not there in the end. For example, the asparagus soup was an excellent replicant of the thai soup, tom yung goong. Didn't come here to eat something I can get somewhere else.",299,"Food was good, but not as",11065,4.0,http://www.opentable.com/coi?rid=11065&tab=2&page=10
425,425,5501bb8dce17c917795f8ef5,"373 BroadwaySan Francisco, CA  94133",5.0,4.0,4.5,Coi,"Coi is without peer when it comes to creativity. We had the Christmas Eve pre-fix dinner; nine courses. We have dined out approximately twice per week for the past 25 years and have encountered many unique combinations. But virtually every course at Coi had one or more ingredients that we had not previously experienced. We like to try different things, so this was a strong favorable point. For those who are highly knowledgeable about foods and cooking, Coi will be unbeatable. For less sophisticated tastes, however, the ultimate question is whether the chef, however creative, leaves the patron feeling as though they had a good satisfying meal. Here Coi falls short. Its portions are very small. Triple two of the courses, please.",736,Will Creativity Satisfy Appetite?,11065,4.0,http://www.opentable.com/coi?rid=11065&tab=2&page=11
426,426,5501bb8ece17c917795f8ef6,"373 BroadwaySan Francisco, CA  94133",3.0,3.0,4.5,Coi,"My dinner partner and I went to Qui and were extremely diappointed. By the by, the tasting bill was $700. Never the cost of dining at Gary Danko's or La Folie. The portions were miniscule. I giess we didn't realize we were stuck with a tasting menu and no opportunity to order of the menu..which didn't exist. We were advised that ""chef likes to surprise you"". When I'm going to what is billed as a top-notch resaurant, I don't want to be surprised. As to the service, one had to beg them for some bread..a slice at a time...and beg for a glasd of red wine for my partner who didn't want all the whites that came with the tasting menu. I would never, ever go back here again. I tought it was the Emperors New Clothes.",717,My dinner partner and I went,11065,3.0,http://www.opentable.com/coi?rid=11065&tab=2&page=12
427,427,5501bb8ece17c917795f8ef7,"373 BroadwaySan Francisco, CA  94133",5.0,5.0,4.5,Coi,"Our second time there. A fabulous splurge. Perfect food (although I'd ditch the buttered popcorn in the one dish). Open your wallet and put yourselves in their hands, wine and all.",180,Our second time there. A,11065,5.0,http://www.opentable.com/coi?rid=11065&tab=2&page=13
428,428,5501bb8ece17c917795f8ef8,"373 BroadwaySan Francisco, CA  94133",4.0,4.0,4.5,Coi,"Went there as a couple. Amazing eleven course meal that took my taste buds on a rollercoaster ride. Great service and great wine pairings for the meal. This is a really different experience with high quality preparation, ingredients and great service.",251,Went there as a couple. Amazing,11065,4.0,http://www.opentable.com/coi?rid=11065&tab=2&page=14
429,429,5501bb8fce17c917795f8ef9,"373 BroadwaySan Francisco, CA  94133",4.0,4.0,4.5,Coi,"The food is clearly the star at Coi. The list of local ingredients on the inside of the menu next to the list of courses speaks volumes about what makes Coi exceptional. Add to that unique palate experiences with temperature (who knew?) and each dish is a delightful surprise.
I haven't had my mind blown like this since dining in Paris. If you're a foodie, do not miss this fantastic opportunity.",397,The food is clearly the star,11065,3.0,http://www.opentable.com/coi?rid=11065&tab=2&page=15
430,430,5501bb8fce17c917795f8efa,"373 BroadwaySan Francisco, CA  94133",5.0,5.0,4.5,Coi,"Wonderful meal, great service. Thoroughly enjoyed ourselves.",60,"Wonderful meal, great service.",11065,5.0,http://www.opentable.com/coi?rid=11065&tab=2&page=16
431,431,5501bb8fce17c917795f8efb,"373 BroadwaySan Francisco, CA  94133",5.0,5.0,4.5,Coi,"Coi is pronounced ""cwah"" as we discovered after our puzzled San Franciscan friends couldn't remember a local restautant called ""coy."" Regardless of its name, this restaurant is nothing less than impeccable. A multi-course, fixed menu treats the diners to only the freshest, simpliest ingredients executed cleanly and beautifully.
Coi is the type of restaurant that is best appreciated by the hard-core foodie, specifically the types who are willing to ask few questions, spend big dollars and sit back and let the chef dazzle them. If you insist on altering the menu to meet your own personal preferences, you will be certainly missing out on the culinary portrait that the chef is painting for you. Just go. Just eat. And be wowed!",732,"Coi is pronounced ""cwah"" as",11065,4.0,http://www.opentable.com/coi?rid=11065&tab=2&page=17
432,432,5501bb8fce17c917795f8efc,"373 BroadwaySan Francisco, CA  94133",1.0,2.0,4.5,Coi,I was very disappointed with Coi. The food was average at best. Our waiter was one of the worst I've had in San Francisco - ever. It is WAY over priced for what you get. Nothing special at all and I would not go again.,218,I was very disappointed with,11065,2.0,http://www.opentable.com/coi?rid=11065&tab=2&page=18
